{
  "UserId": "user-123",
  "TransactionId": "txn-456",
  "Action": "rooms",
  "SubAction": "list",
  "Content": "",
  "Mode": "App",
  "Version": "1.0",
  "Rooms": [
    {
      "UserId": "user-123",
      "TransactionId": "txn-789",
      "Action": "room",
      "SubAction": "info",
      "Content": "",
      "Mode": "App",
      "Version": "1.0",
      "Name": "General",
      "Emoji": "ðŸ’¬",
      "AutoStart": "true",
      "MerMaidGraph": "graph TD; A-->B;",
      "Yaml": "room: General\nemoji: ðŸ’¬",
      "Errors": [
        {
          "Message": "No error",
          "Location": "header"
        }
      ],
      "Rooms": [
        {
          "Name": "General",
          "Emoji": "ðŸ’¬",
          "Agents": [
            {
              "Name": "Agent1",
              "Emoji": "ðŸ¤–"
            }
          ]
        }
      ]
    }
  ]
}
